<!ELEMENT practica (alumno+)>
<!ELEMENT alumno (nif, resultado, observaciones, IP)>
    <!ATTLIST alumno codigo CDATA #REQUIRED>
<!ELEMENT nif (#PCDATA)>
<!ELEMENT resultado (#PCDATA)>
<!ELEMENT observaciones (#PCDATA)>
<!ELEMENT IP (#PCDATA)>